category_id,line,item,category_name,category_description
201,A1,001,Braking Systems,Components involved in halting vehicle motion
202,A2,002,Oil Filters,Parts for filtering contaminants from engine oil
203,A3,003,Wipers,Devices used to remove rain and debris from the windshield
204,A4,004,Exhaust Systems,Parts involved in vehicle exhaust systems
205,A5,005,Wheels,All varieties of vehicle wheels
206,A6,006,Suspension Systems,Components that support ride quality and handling
207,A7,007,Car Covers,Specialty covers to protect cars from external elements
208,A8,008,Car Audio Systems,High-fidelity audio systems for enhanced in-car entertainment